{
  "$comment": "JSON schema file should not be modified as it is generated from the typescript definition using 'npx typescript-json-schema'.",
  "$id": "writing-task",
  "$schema": "http://json-schema.org/draft-07/schema#",
  "additionalProperties": false,
  "definitions": {
    "Rule": {
      "properties": {
        "children": {
          "items": {
            "$ref": "#/definitions/Rule"
          },
          "type": "array"
        },
        "cv_description": {
          "type": "string"
        },
        "description": {
          "description": "Human readable description of the rule.",
          "type": "string"
        },
        "examples": {
          "type": "string"
        },
        "is_group": {
          "type": "boolean"
        },
        "name": {
          "description": "Rule name, used for rule lookup.",
          "type": "string"
        },
        "parent": {
          "description": "Parent rule name.",
          "type": ["string", "null"]
        },
        "sentenceCount": {
          "type": "number"
        },
        "topics": {
          "items": {
            "properties": {
              "custom_topics": {
                "items": {
                  "type": "string"
                },
                "type": "array"
              },
              "lemma": {
                "type": "string"
              },
              "no_lexical_overlap": {
                "type": "boolean"
              },
              "pre_defined_topics": {
                "items": {
                  "type": "string"
                },
                "type": "array"
              },
              "user_defined": {
                "description": "True if topic is user generated.",
                "type": "boolean"
              }
            },
            "type": "object"
          },
          "type": "array"
        },
        "type": {
          "type": "string"
        }
      },
      "type": "object"
    }
  },
  "description": "Schema for a myProse writing tasks specification json file.",
  "properties": {
    "extra_instructions": {
      "type": "string"
    },
    "impressions": {
      "description": "Extra information for Impressions tool.",
      "properties": {
        "common_clusters": {
          "items": {
            "type": "string"
          },
          "type": "array"
        },
        "rare_clusters": {
          "items": {
            "type": "string"
          },
          "type": "array"
        }
      },
      "type": "object"
    },
    "info": {
      "description": "Metadata about the task.",
      "properties": {
        "author": {
          "description": "Author of the outline.",
          "type": "string"
        },
        "copyright": {
          "description": "Copyright information.",
          "type": "string"
        },
        "dict_path": {
          "type": "string"
        },
        "filename": {
          "description": "OS filename",
          "type": "string"
        },
        "name": {
          "description": "Title of the Writing Task/Outline",
          "type": "string"
        },
        "saved": {
          "description": "Last modified date, expected to be ISO 8601 format.",
          "type": "string"
        },
        "target_lang": {
          "description": "Optinally specify the output language for LLM templates. (Default configured in server settings)",
          "type": "string"
        },
        "user_lang": {
          "description": "Optionally specify the input language for LLM templates. (Default configured in server settings)",
          "type": "string"
        },
        "version": {
          "description": "String used to identify the version of the outline, expected to be a SemTag",
          "type": "string"
        }
      },
      "type": "object"
    },
    "public": {
      "description": "True if the task is listed in publicly available listings.  This is normally set by the server.",
      "type": "boolean"
    },
    "rules": {
      "description": "Outline rules.",
      "properties": {
        "name": {
          "description": "Title of the rule set.",
          "type": "string"
        },
        "overview": {
          "description": "Human readable description of the overall rule set/outline.",
          "type": "string"
        },
        "rules": {
          "description": "List of top-level rules.",
          "items": {
            "$ref": "#/definitions/Rule"
          },
          "type": "array"
        }
      },
      "type": "object"
    },
    "values": {},
    "wtd_version": {
      "type": "string"
    }
  },
  "type": "object"
}
